{
  "tenant_id": "acme-corp",
  "run_id": "run-0001",
  "repo_commit": "cccccccccccccccccccccccccccccccccccccccc",
  "content_hash": "sha256:aaaaaaaaaaaaaaaaaaaaaaaaaaaaaaaaaaaaaaaaaaaaaaaaaaaaaaaaaaaaaaaa",
  "snapshot_uri": "s3://saena-snapshots/run-0001/snapshot.tar.gz",
  "source_type": "git",
  "sbom_uri": "s3://saena-sboms/run-0001/sbom.json",
  "secret_scan_status": "passed",
  "captured_at": "2026-07-12T09:00:00Z"
}
